{
  "apiVersion": "holmes.socioprophet.dev/v1",
  "kind": "HolmesSurface",
  "metadata": {
    "name": "holmes-core",
    "version": "0.1.0"
  },
  "spec": {
    "product": "Holmes",
    "tagline": "Component NLP annotates. Holmes investigates.",
    "components": [
      "sherlock-search",
      "221b",
      "mycroft-router",
      "moriarty-bench",
      "irene-shield",
      "the-canon",
      "deduction-engine"
    ],
    "componentFamilies": [
      "basic-primitives",
      "advanced-primitives",
      "rule-techniques",
      "classical-ml",
      "neural-nlp",
      "transformers",
      "foundation-language-services",
      "retrieval-and-knowledge",
      "guardrails-and-governance",
      "agent-and-tool-orchestration"
    ],
    "nlpTasks": [
      "language-identification",
      "sentence-segmentation",
      "tokenization",
      "lemmatization",
      "part-of-speech-tagging",
      "morphological-features",
      "dependency-parsing",
      "semantic-role-labeling",
      "entity-extraction",
      "numeric-entity-extraction",
      "pii-extraction",
      "coreference-resolution",
      "relation-extraction",
      "text-classification",
      "zero-shot-classification",
      "sentiment-classification",
      "target-sentiment-extraction",
      "keyword-extraction",
      "category-classification",
      "concept-linking",
      "topic-modeling",
      "topic-model-training",
      "topic-taxonomy-induction",
      "topic-pack-generation",
      "topical-clustering",
      "text-similarity",
      "table-header-identification",
      "claim-extraction",
      "contradiction-detection",
      "semantic-graph-conversion",
      "evidence-governance"
    ],
    "methodFamilies": [
      "language.primitive.v1/Analyze",
      "language.entity.v1/Extract",
      "language.relation.v1/Extract",
      "language.classify.v1/Classify",
      "language.embed.v1/Embed",
      "language.rerank.v1/Rerank",
      "language.translate.v1/Translate",
      "language.summarize.v1/Summarize",
      "language.rag.v1/Answer",
      "language.topic.v1/Propose",
      "language.topic.v1/Train",
      "language.graph.v1/ToSemanticGraph",
      "language.govern.v1/Evaluate"
    ],
    "requiredPromotionEvidence": [
      "corpusRef",
      "pipelineOrModelRef",
      "algorithmFamily",
      "taskContract",
      "evalRecord",
      "latencyFootprintRecord",
      "slashTopicsTrainingRef",
      "guardrailPolicy",
      "evidenceReceipt",
      "promotionRecord",
      "rollbackRef"
    ],
    "integrations": {
      "standards": "SocioProphet/functional-model-surfaces",
      "platform": "SocioProphet/prophet-platform",
      "search": "SocioProphet/sherlock-search",
      "slashTopics": "SocioProphet/slash-topics",
      "lab": "SociOS-Linux/nlplab",
      "sourceosCarry": "SourceOS-Linux/sourceos-model-carry"
    }
  }
}
